{
  "name": "ConfigProvider",
  "package": "@oceanbase/design",
  "diffLevel": "B",
  "extendsAntd": "ConfigProvider",
  "delegateAntd": true,
  "addedProps": [
    "navigate",
    "hideOnSinglePage",
    "card",
    "spin",
    "table",
    "styleProviderProps",
    "appProps",
    "theme.isAliyun",
    "theme.isDark",
    "theme.isCompact",
    "notification.duration"
  ],
  "constraints": ["config-provider-root"],
  "keywords": [
    "config",
    "theme",
    "locale",
    "isAliyun",
    "isDark",
    "isCompact",
    "notification",
    "duration"
  ],
  "importFrom": "@oceanbase/design",
  "propsSource": "packages/design/src/config-provider/index.tsx",
  "docSource": "packages/design/src/config-provider/index.md"
}
