{
  "name": "Empty",
  "package": "@oceanbase/design",
  "diffLevel": "C",
  "extendsAntd": "Empty",
  "delegateAntd": true,
  "addedProps": ["title", "steps", "layout", "fullHeight"],
  "constraints": [],
  "keywords": ["empty", "placeholder", "no-data"],
  "importFrom": "@oceanbase/design",
  "propsSource": "packages/design/src/empty/index.tsx",
  "docSource": "packages/design/src/empty/index.md"
}
